{
  "$schema": "./_schemas/vr-companion.schema.json",
  "templateId": "vr-companion",
  "templateVersion": "1.0.0",
  "description": "Persistent VR companion. Follows the player and speaks on push-to-talk or proximity. Use locationAwareness to scope RAG retrieval to the current scene.",
  "companionId": "${COMPANION_ID}",
  "displayName": "${COMPANION_DISPLAY_NAME}",
  "persona": {
    "summary": "${COMPANION_PERSONA_SUMMARY}",
    "tone": "${COMPANION_TONE}",
    "speechQuirks": [
      "${COMPANION_QUIRK_1}"
    ]
  },
  "voice": {
    "voiceId": "${KOKORO_VOICE_ID}",
    "speed": 1.0
  },
  "presence": {
    "followDistanceMeters": 1.5,
    "speakOn": ["push_to_talk", "proximity"],
    "wakeWord": "${OPTIONAL_WAKE_WORD}",
    "locationAwareness": {
      "enabled": true,
      "ragRadiusMeters": 5,
      "knowledgeTagPrefix": "${LOCATION_TAG_PREFIX}"
    }
  },
  "promptRules": {
    "maxWordsPerResponse": 35,
    "plainSpoken": true,
    "noThink": true
  }
}
